<!ELEMENT user (name,email,country,phone)>
   <!ELEMENT fname (#PCDATA)>
   <!ELEMENT lname (#PCDATA)>
   <!ELEMENT email (#PCDATA)>
   <!ELEMENT gender (#PCDATA)>
   <!ELEMENT country (#PCDATA)>
   <!ELEMENT DOB (#PCDATA)>
   <!ELEMENT phone (#PCDATA)>